{
  "created_at": "RFC3339",
  "escalation_reason": null,
  "excluded": [],
  "filters": {
    "active_only": true,
    "authority": [
      "observed",
      "verified"
    ],
    "freshness": true,
    "owners": [
      "*"
    ],
    "privacy": [
      "public",
      "team"
    ]
  },
  "id": "UUIDV4",
  "phase_seconds": {
    "index": 0.0,
    "retrieval": 0.0,
    "stat": 0.0
  },
  "provider": "sqlite-fts5",
  "query": "Query",
  "query_source": "prompt",
  "schema_version": 2,
  "selected": [],
  "task_id": "UUIDV4",
  "task_revision": 1,
  "token_estimates": {
    "durable": 0,
    "dynamic": 0,
    "evidence": 0,
    "handoff": 0,
    "hard": 12000,
    "policy": 0,
    "target": 8000,
    "total": 0
  }
}
